{
  "backup_path": ".agent-policy/adoption/original/AGENTS.md",
  "config_path": ".agent-policy.yml",
  "final_output": "AGENTS.md",
  "generated_skills": [
    "maintain-progressive-discovery"
  ],
  "preview_output": ".agent-policy/preview/AGENTS.md",
  "primary_instructions": "AGENTS.md",
  "project_policy_files": [
    "policy/project.md"
  ],
  "schema_version": 1,
  "selected_profiles": [
    "core",
    "security-baseline",
    "pull-request",
    "progressive-discovery"
  ],
  "sources": [
    {
      "generated": false,
      "path": ".agents/skills/land-templates-stack/SKILL.md",
      "sha256": "9ea07fb47437a9fd2c2697eb28bcc5b9f17bf6736d76624ff1c9b5053c6bbf9e"
    },
    {
      "generated": false,
      "path": ".agents/skills/land-templates-stack/source.json",
      "sha256": "e40ab2abc8bc68e1c30f34c46e6c21f434cd66605d4a63bb6d72b8acd741569f"
    },
    {
      "generated": true,
      "path": ".agents/skills/maintain-progressive-discovery/SKILL.md",
      "sha256": "3425fc674d459732f806ff35fdc8753de0f8d30c75766f318b141dac56a35b5b"
    },
    {
      "generated": true,
      "path": ".agents/skills/maintain-progressive-discovery/scripts/maintain_progressive_discovery.py",
      "sha256": "1ce656be2ae8f9f7108d850c2539932ae49ef93cfb33ba9e02aaf9d83020988d"
    },
    {
      "generated": false,
      "path": ".agents/skills/pr-merge-gate/SKILL.md",
      "sha256": "cceb459ea27c0c5cbc93d568fb99224efa45aba0e78651b513b42874343a6514"
    },
    {
      "generated": false,
      "path": ".agents/skills/pr-merge-gate/source.json",
      "sha256": "e2833c6cfa650c42b0b1bf654026d8f1a7065dbab17bcde6d07cae1407429f86"
    },
    {
      "generated": false,
      "path": ".agents/skills/site-browser-regression-triage/SKILL.md",
      "sha256": "072b3f10a3b23078f16e13d0ef2fdf79edbe163bfb09b264ec1818250dee8424"
    },
    {
      "generated": false,
      "path": ".agents/skills/site-pr-exact-head-acceptance/SKILL.md",
      "sha256": "a98372f7b24816ec6eb391dd0e72636964d32cf05267a94dad0322da68ecb7bf"
    },
    {
      "generated": false,
      "path": ".agents/skills/site-publication-cutover/SKILL.md",
      "sha256": "7e006559409f6b34b04d1cee80e17db57c6f0d2aabb369d1a8ac1c4afde92226"
    },
    {
      "generated": true,
      "path": "AGENTS.md",
      "sha256": "294f04a53194a0c120900dfc60211b1660ad8334969ab1b85e31520df9eee06f"
    }
  ],
  "state_path": ".agent-policy/adoption.json",
  "status": "finalized",
  "toolchain": {
    "repository": "TakashiSasaki/templates",
    "revision": "aa6f9ac4822cbbb9b7bb6940525d54ad690d76d3"
  },
  "verification_command": null
}
